{"$id":"safe-checkpoint-loader-policy.v0.schema.json","$schema":"https://json-schema.org/draft/2020-12/schema","additionalProperties":false,"properties":{"appliesTo":{"items":{"enum":["REG-MATTE-MODNET@0.1.0","REG-MATTE-RVM-MOBILENETV3@0.1.0"]},"maxItems":2,"minItems":2,"type":"array"},"contentHash":{"pattern":"^[a-f0-9]{64}$","type":"string"},"deserialization":{"items":{"minLength":1,"pattern":".*\\S.*","type":"string"},"minItems":1,"type":"array"},"evidenceBoundary":{"additionalProperties":false,"properties":{"c1":{"const":0},"e1":{"const":0},"g1":{"const":0},"o1":{"const":0},"productSupport":{"const":false},"r1Pipeline":{"const":0},"r1ProductRelease":{"const":0},"r1ProductValidation":{"const":0},"u1":{"const":0},"v1":{"const":0}},"required":["c1","u1","e1","r1Pipeline","r1ProductValidation","r1ProductRelease","o1","g1","v1","productSupport"],"type":"object"},"frozenAt":{"pattern":"^20[0-9]{2}-[0-9]{2}-[0-9]{2}T[0-9]{2}:[0-9]{2}:[0-9]{2}\\.[0-9]{3}Z$","type":"string"},"hardStops":{"items":{"minLength":1,"pattern":".*\\S.*","type":"string"},"minItems":1,"type":"array"},"implementation":{"additionalProperties":false,"properties":{"artifactInspectionAuthorized":{"const":false},"loaderImplementationSha256State":{"const":"not-created"},"loaderImplemented":{"const":false},"modelConstructionAuthorized":{"const":false},"negativeTestsCreated":{"const":false},"runtimeSelected":{"const":false}},"required":["loaderImplemented","loaderImplementationSha256State","runtimeSelected","negativeTestsCreated","artifactInspectionAuthorized","modelConstructionAuthorized"],"type":"object"},"isolation":{"items":{"minLength":1,"pattern":".*\\S.*","type":"string"},"minItems":1,"type":"array"},"policyId":{"const":"POLICY-MATTE-SAFE-CHECKPOINT-LOAD@0.1.0"},"postLoad":{"items":{"minLength":1,"pattern":".*\\S.*","type":"string"},"minItems":1,"type":"array"},"preLoad":{"items":{"minLength":1,"pattern":".*\\S.*","type":"string"},"minItems":1,"type":"array"},"schemaVersion":{"const":"safe-checkpoint-loader-policy.v0"},"state":{"const":"policy-frozen-implementation-not-created-loading-forbidden"}},"required":["schemaVersion","policyId","frozenAt","state","appliesTo","preLoad","isolation","deserialization","postLoad","implementation","hardStops","evidenceBoundary","contentHash"],"type":"object"}
