{"appliesTo":["REG-MATTE-MODNET@0.1.0","REG-MATTE-RVM-MOBILENETV3@0.1.0"],"contentHash":"5b49263321783129db2dd0b748d6184a5856cb07533e75f23c65afd6fad74e87","deserialization":["never call the upstream torch.load or torch.hub loader directly on unreviewed bytes","selected runtime must support a reviewed weights-only or equivalently non-executable state-dict extraction path","reject checkpoint-provided custom classes, reducers, code objects, modules, optimizers, schedulers, arbitrary metadata, and unexpected tensor keys","permit only bounded primitive containers and tensors matching a separately frozen key, dtype, shape, and total-element allowlist"],"evidenceBoundary":{"c1":0,"e1":0,"g1":0,"o1":0,"productSupport":false,"r1Pipeline":0,"r1ProductRelease":0,"r1ProductValidation":0,"u1":0,"v1":0},"frozenAt":"2026-08-16T03:46:26.424Z","hardStops":["unsafe pickle-compatible fallback","remote-code import","automatic download","unknown custom object","unexpected tensor inventory","resource limit breach","network access","unapproved artifact or runtime drift","inference or natural-image access"],"implementation":{"artifactInspectionAuthorized":false,"loaderImplementationSha256State":"not-created","loaderImplemented":false,"modelConstructionAuthorized":false,"negativeTestsCreated":false,"runtimeSelected":false},"isolation":["run in a fresh no-network subprocess with no user credentials, home-directory access, package cache, or writable import path","mount checkpoint and approved source read-only; expose only attempt-scoped output and bounded logs","deny subprocess creation, dynamic native library discovery, remote code, torch hub, and automatic downloads","apply wall-time, CPU, memory, file-count, byte-count, and log-length limits before inspection"],"policyId":"POLICY-MATTE-SAFE-CHECKPOINT-LOAD@0.1.0","postLoad":["loading success is not inference authorization","re-hash original bytes and record loader outcome without rewriting the acquisition identity","model construction uses approved local source only and remains network-disabled","any converted or derived format receives a new ID, hash, license review, schema, and evidence boundary"],"preLoad":["capture immutable acquisition receipt, final redirect chain, byte length, content type, and SHA-256 before any parser or framework touches bytes","store original bytes read-only outside repository, product, and system temp roots","independent reviewer must pin artifact identity, license, runtime lock, SBOM, hardware profile, and loader implementation hash","reject size, host, path, extension, content-type, or digest mismatch before deserialization"],"schemaVersion":"safe-checkpoint-loader-policy.v0","state":"policy-frozen-implementation-not-created-loading-forbidden"}
